{
  "aliases": [],
  "bundleHash": "sha256:9085f370a0131ba1442ee458cd5ce90e54a78c772fe2d3b433153924ea60950f",
  "commonNames": [],
  "description": null,
  "displayName": {
    "language": "la",
    "refs": [
      "wcvp:3088365"
    ],
    "value": "Cassinia laevis"
  },
  "family": {
    "refs": [
      "wcvp:3088365"
    ],
    "value": "Asteraceae"
  },
  "goals": [],
  "id": "cassinia-laevis",
  "image": {
    "attributionRequired": true,
    "author": "Cgoodwin",
    "license": "CC BY-SA 3.0",
    "licenseUrl": "https://creativecommons.org/licenses/by-sa/3.0",
    "pageUrl": "https://commons.wikimedia.org/wiki/File:Cassinia_laevis.JPG",
    "refs": [
      "commons:File:Cassinia laevis.JPG"
    ],
    "url": "https://upload.wikimedia.org/wikipedia/commons/a/aa/Cassinia_laevis.JPG"
  },
  "model": "claude-sonnet-5-5",
  "oil": null,
  "origin": {
    "refs": [
      "wcvp:3088365"
    ],
    "value": "Australia."
  },
  "partsUsed": [],
  "promptVersion": 7,
  "recordVersion": 1,
  "refs": {
    "commons:File:Cassinia laevis.JPG": {
      "dataset": "commons",
      "label": "Wikimedia Commons: File:Cassinia laevis.JPG",
      "license": "CC BY-SA 3.0",
      "url": "https://commons.wikimedia.org/wiki/File:Cassinia_laevis.JPG"
    },
    "wcvp:3088365": {
      "dataset": "wcvp",
      "label": "WCVP: Cassinia laevis R.Br.",
      "license": "CC BY 3.0"
    },
    "wcvp:3194094": {
      "dataset": "wcvp",
      "label": "WCVP: Cassinia aculeata var. laevis (R.Br.) J.M.Black",
      "license": "CC BY 3.0"
    }
  },
  "reviewFlags": [
    {
      "code": "sin-nombre-comun-es",
      "message": "El paquete no trae ningún nombre común en español; se usa el nombre científico.",
      "target": "displayName"
    },
    {
      "code": "sin-datos-de-seguridad",
      "message": "El paquete no trae información de seguridad; la planta no se presenta como segura.",
      "target": "safety"
    }
  ],
  "safety": null,
  "scientificName": {
    "authors": "R.Br.",
    "name": "Cassinia laevis",
    "refs": [
      "wcvp:3088365"
    ]
  },
  "sources": [
    {
      "dataset": "commons",
      "license": "CC BY-SA 3.0"
    },
    {
      "dataset": "wcvp",
      "license": "CC BY 3.0"
    }
  ],
  "synonyms": [
    {
      "authors": "(R.Br.) J.M.Black",
      "name": "Cassinia aculeata var. laevis",
      "refs": [
        "wcvp:3194094"
      ]
    }
  ],
  "traditionalUses": []
}
