{
  "aliases": [],
  "bundleHash": "sha256:67cb4d028da725204d3528f692d813beab0e97dcb491260ca16b6413a6e6b222",
  "commonNames": [],
  "description": null,
  "displayName": {
    "language": "la",
    "refs": [
      "wcvp:384447"
    ],
    "value": "Diospyros mollis"
  },
  "family": {
    "refs": [
      "wcvp:384447"
    ],
    "value": "Ebenaceae"
  },
  "goals": [],
  "id": "diospyros-mollis",
  "image": {
    "attributionRequired": false,
    "author": "Pamputt",
    "license": "CC0",
    "licenseUrl": "http://creativecommons.org/publicdomain/zero/1.0/deed.en",
    "pageUrl": "https://commons.wikimedia.org/wiki/File:Diospyros_mollis.JPG",
    "refs": [
      "commons:File:Diospyros mollis.JPG"
    ],
    "url": "https://upload.wikimedia.org/wikipedia/commons/8/8c/Diospyros_mollis.JPG"
  },
  "model": "claude-sonnet-5-5",
  "oil": null,
  "origin": {
    "refs": [
      "wcvp:384447"
    ],
    "value": "Indochina"
  },
  "partsUsed": [],
  "promptVersion": 7,
  "recordVersion": 1,
  "refs": {
    "commons:File:Diospyros mollis.JPG": {
      "dataset": "commons",
      "label": "Wikimedia Commons: File:Diospyros mollis.JPG",
      "license": "CC0",
      "url": "https://commons.wikimedia.org/wiki/File:Diospyros_mollis.JPG"
    },
    "wcvp:384447": {
      "dataset": "wcvp",
      "label": "WCVP: Diospyros mollis Griff.",
      "license": "CC BY 3.0"
    }
  },
  "reviewFlags": [
    {
      "code": "sin-nombre-comun-es",
      "message": "El paquete no trae ningún nombre común en español (la etiqueta de Wikidata es el nombre científico); el displayName es el nombre científico.",
      "target": "displayName"
    },
    {
      "code": "sin-datos-de-seguridad",
      "message": "El paquete no trae ninguna información de seguridad (sin fichas de la EMA, TPPT ni EFSA ni señales de riesgo en los usos de USDA); la planta no se presenta como segura.",
      "target": "safety"
    }
  ],
  "safety": null,
  "scientificName": {
    "authors": "Griff.",
    "name": "Diospyros mollis",
    "refs": [
      "wcvp:384447"
    ]
  },
  "sources": [
    {
      "dataset": "commons",
      "license": "CC0"
    },
    {
      "dataset": "wcvp",
      "license": "CC BY 3.0"
    }
  ],
  "synonyms": [],
  "traditionalUses": []
}
