{
  "aliases": [],
  "bundleHash": "sha256:aa13363445244be5437f5513308818a254f1759f4feb72b4c2360d881ca7ed7d",
  "commonNames": [
    {
      "language": "en",
      "refs": [
        "usda_common_name:815-1"
      ],
      "text": "Loomis' Mountain Mint"
    }
  ],
  "description": null,
  "displayName": {
    "language": "la",
    "refs": [
      "wcvp:171058"
    ],
    "value": "Pycnanthemum loomisii"
  },
  "family": {
    "refs": [
      "wcvp:171058"
    ],
    "value": "Lamiaceae"
  },
  "goals": [],
  "id": "pycnanthemum-loomisii",
  "image": null,
  "model": "claude-sonnet-5-5",
  "oil": {
    "refs": [
      "usda_part:815-SH"
    ],
    "type": "Esencial"
  },
  "origin": {
    "refs": [
      "wcvp:171058"
    ],
    "value": "Nativa del centro-norte, noreste y sureste de Estados Unidos."
  },
  "partsUsed": [],
  "promptVersion": 7,
  "recordVersion": 1,
  "refs": {
    "usda_common_name:815-1": {
      "dataset": "usda",
      "label": "USDA Dr. Duke: nombre común «Loomis' Mountain Mint»",
      "license": "CC0"
    },
    "usda_part:815-SH": {
      "dataset": "usda",
      "label": "USDA Dr. Duke: química de la parte «Shoot»",
      "license": "CC0"
    },
    "wcvp:171058": {
      "dataset": "wcvp",
      "label": "WCVP: Pycnanthemum loomisii Nutt.",
      "license": "CC BY 3.0"
    }
  },
  "reviewFlags": [
    {
      "code": "sin-nombre-comun-es",
      "message": "El paquete no trae ningún nombre común en español; el nombre mostrado es el nombre científico.",
      "target": "displayName"
    },
    {
      "code": "aceite-por-compuesto-eo",
      "message": "El aceite esencial se deduce solo del compuesto EO de USDA, sin ficha aetheroleum de la EMA.",
      "target": "oil"
    },
    {
      "code": "sin-datos-de-seguridad",
      "message": "El paquete no trae ninguna información de seguridad; la planta no se presenta como segura.",
      "target": "safety"
    }
  ],
  "safety": null,
  "scientificName": {
    "authors": "Nutt.",
    "name": "Pycnanthemum loomisii",
    "refs": [
      "wcvp:171058"
    ]
  },
  "sources": [
    {
      "dataset": "usda",
      "license": "CC0"
    },
    {
      "dataset": "wcvp",
      "license": "CC BY 3.0"
    }
  ],
  "synonyms": [],
  "traditionalUses": []
}
