{
  "aliases": [],
  "bundleHash": "sha256:29281c4298fbfcf44cb047a325eb67d57adfd6b3eb7e2aae649c752ab47091a5",
  "commonNames": [],
  "description": null,
  "displayName": {
    "language": "la",
    "refs": [
      "wcvp:2801733"
    ],
    "value": "Erythroxylum zambesiacum"
  },
  "family": {
    "refs": [
      "wcvp:2801733"
    ],
    "value": "Erythroxylaceae"
  },
  "goals": [],
  "id": "erythroxylum-zambesiacum",
  "image": null,
  "model": "claude-sonnet-5-5",
  "oil": null,
  "origin": {
    "refs": [
      "wcvp:2801733"
    ],
    "value": "Nativa del este y el sur de África tropical y del sur de África."
  },
  "partsUsed": [],
  "promptVersion": 7,
  "recordVersion": 1,
  "refs": {
    "wcvp:2801733": {
      "dataset": "wcvp",
      "label": "WCVP: Erythroxylum zambesiacum N.Robson",
      "license": "CC BY 3.0"
    }
  },
  "reviewFlags": [
    {
      "code": "sin-nombre-comun-es",
      "message": "El paquete no trae ningún nombre común en español; el displayName es el nombre científico.",
      "target": "displayName"
    },
    {
      "code": "sin-datos-de-seguridad",
      "message": "El paquete no trae ninguna información de seguridad; la planta no se presenta como segura.",
      "target": "safety"
    }
  ],
  "safety": null,
  "scientificName": {
    "authors": "N.Robson",
    "name": "Erythroxylum zambesiacum",
    "refs": [
      "wcvp:2801733"
    ]
  },
  "sources": [
    {
      "dataset": "wcvp",
      "license": "CC BY 3.0"
    }
  ],
  "synonyms": [],
  "traditionalUses": []
}
