{
  "aliases": [
    "wormia-burbidgei"
  ],
  "bundleHash": "sha256:151c3c83431f7ec1ee4b84ca9df697bae6887329a0b187099c5d4414676474e8",
  "commonNames": [],
  "description": null,
  "displayName": {
    "language": "la",
    "refs": [
      "wcvp:2768341"
    ],
    "value": "Dillenia suffruticosa"
  },
  "family": {
    "refs": [
      "wcvp:2768341"
    ],
    "value": "Dilleniaceae"
  },
  "goals": [],
  "id": "dillenia-suffruticosa",
  "image": {
    "attributionRequired": true,
    "author": "Wibowo Djatmiko ( Wie146 )",
    "license": "CC BY-SA 3.0",
    "licenseUrl": "https://creativecommons.org/licenses/by-sa/3.0",
    "pageUrl": "https://commons.wikimedia.org/wiki/File:Dil_suffrut_100524-1817_sap.jpg",
    "refs": [
      "commons:File:Dil suffrut 100524-1817 sap.jpg"
    ],
    "url": "https://upload.wikimedia.org/wikipedia/commons/4/45/Dil_suffrut_100524-1817_sap.jpg"
  },
  "model": "claude-sonnet-5-5",
  "oil": null,
  "origin": {
    "refs": [
      "wcvp:2768341"
    ],
    "value": "Malesia (Borneo, Malaya, Filipinas y Sumatra)."
  },
  "partsUsed": [],
  "promptVersion": 7,
  "recordVersion": 1,
  "refs": {
    "commons:File:Dil suffrut 100524-1817 sap.jpg": {
      "dataset": "commons",
      "label": "Wikimedia Commons: File:Dil suffrut 100524-1817 sap.jpg",
      "license": "CC BY-SA 3.0",
      "url": "https://commons.wikimedia.org/wiki/File:Dil_suffrut_100524-1817_sap.jpg"
    },
    "wcvp:2466280": {
      "dataset": "wcvp",
      "label": "WCVP: Wormia suffruticosa Griff. ex Hook.f. & Thomson",
      "license": "CC BY 3.0"
    },
    "wcvp:2768341": {
      "dataset": "wcvp",
      "label": "WCVP: Dillenia suffruticosa (Griff. ex Hook.f. & Thomson) Martelli",
      "license": "CC BY 3.0"
    }
  },
  "reviewFlags": [
    {
      "code": "sin-nombre-comun-es",
      "message": "El paquete no trae ningún nombre común en español; el displayName es el nombre científico.",
      "target": "displayName"
    },
    {
      "code": "sin-datos-de-seguridad",
      "message": "El paquete no trae ninguna información de seguridad; la planta no se presenta como segura.",
      "target": "safety"
    }
  ],
  "safety": null,
  "scientificName": {
    "authors": "(Griff. ex Hook.f. & Thomson) Martelli",
    "name": "Dillenia suffruticosa",
    "refs": [
      "wcvp:2768341"
    ]
  },
  "sources": [
    {
      "dataset": "commons",
      "license": "CC BY-SA 3.0"
    },
    {
      "dataset": "wcvp",
      "license": "CC BY 3.0"
    }
  ],
  "synonyms": [
    {
      "authors": "Griff. ex Hook.f. & Thomson",
      "name": "Wormia suffruticosa",
      "refs": [
        "wcvp:2466280"
      ]
    }
  ],
  "traditionalUses": []
}
