{
  "aliases": [
    "valerianella-radicata"
  ],
  "bundleHash": "sha256:8a8fb45d94b6b93644e1c8b997be73dea7918bff3521713f3f36f652e27b6b0a",
  "commonNames": [],
  "description": null,
  "displayName": {
    "language": "la",
    "refs": [
      "wcvp:3225934"
    ],
    "value": "Valeriana woodsiana"
  },
  "family": {
    "refs": [
      "wcvp:3225934"
    ],
    "value": "Caprifoliaceae"
  },
  "goals": [],
  "id": "valeriana-woodsiana",
  "image": {
    "attributionRequired": true,
    "author": "Matthias Buchmeier",
    "license": "CC BY-SA 3.0",
    "licenseUrl": "https://creativecommons.org/licenses/by-sa/3.0",
    "pageUrl": "https://commons.wikimedia.org/wiki/File:Valerianella_radiata_flowering_plant.jpg",
    "refs": [
      "commons:File:Valerianella radiata flowering plant.jpg"
    ],
    "url": "https://upload.wikimedia.org/wikipedia/commons/9/94/Valerianella_radiata_flowering_plant.jpg"
  },
  "model": "claude-sonnet-5-5",
  "oil": null,
  "origin": {
    "refs": [
      "wcvp:3225934"
    ],
    "value": "Centro-norte, noreste, centro-sur y sureste de Estados Unidos"
  },
  "partsUsed": [],
  "promptVersion": 7,
  "recordVersion": 1,
  "refs": {
    "commons:File:Valerianella radiata flowering plant.jpg": {
      "dataset": "commons",
      "label": "Wikimedia Commons: File:Valerianella radiata flowering plant.jpg",
      "license": "CC BY-SA 3.0",
      "url": "https://commons.wikimedia.org/wiki/File:Valerianella_radiata_flowering_plant.jpg"
    },
    "wcvp:2463471": {
      "dataset": "wcvp",
      "label": "WCVP: Valerianella woodsiana (Torr. & A.Gray) Walp.",
      "license": "CC BY 3.0"
    },
    "wcvp:2808022": {
      "dataset": "wcvp",
      "label": "WCVP: Fedia woodsiana Torr. & A.Gray",
      "license": "CC BY 3.0"
    },
    "wcvp:3225934": {
      "dataset": "wcvp",
      "label": "WCVP: Valeriana woodsiana (Torr. & A.Gray) Christenh. & Byng",
      "license": "CC BY 3.0"
    }
  },
  "reviewFlags": [
    {
      "code": "coincidencia-aproximada",
      "message": "El nombre resolvió por coincidencia aproximada (errata probable); requiere revisión.",
      "target": "scientificName"
    },
    {
      "code": "sin-nombre-comun-es",
      "message": "El paquete no trae ningún nombre común en español; el nombre mostrado es el científico.",
      "target": "displayName"
    },
    {
      "code": "sin-datos-de-seguridad",
      "message": "El paquete no trae información de seguridad; la planta no se presenta como segura.",
      "target": "safety"
    }
  ],
  "safety": null,
  "scientificName": {
    "authors": "(Torr. & A.Gray) Christenh. & Byng",
    "name": "Valeriana woodsiana",
    "refs": [
      "wcvp:3225934"
    ]
  },
  "sources": [
    {
      "dataset": "commons",
      "license": "CC BY-SA 3.0"
    },
    {
      "dataset": "wcvp",
      "license": "CC BY 3.0"
    }
  ],
  "synonyms": [
    {
      "authors": "Torr. & A.Gray",
      "name": "Fedia woodsiana",
      "refs": [
        "wcvp:2808022"
      ]
    },
    {
      "authors": "(Torr. & A.Gray) Walp.",
      "name": "Valerianella woodsiana",
      "refs": [
        "wcvp:2463471"
      ]
    }
  ],
  "traditionalUses": []
}
