{
  "aliases": [
    "erythroxylum-argentatum"
  ],
  "bundleHash": "sha256:b153823afb9faea7d09b4905912282a4b9d4f2241bd24e7ff284dbf131a37811",
  "commonNames": [],
  "description": {
    "refs": [
      "wikipedia_es:Erythroxylum argentinum"
    ],
    "value": "Especie de planta de la familia Erythroxylaceae que se distribuye en Argentina, Bolivia y Brasil. Según Wikipedia en español, contiene el alcaloide cocaína."
  },
  "displayName": {
    "language": "la",
    "refs": [
      "wcvp:2801265"
    ],
    "value": "Erythroxylum argentinum"
  },
  "family": {
    "refs": [
      "wcvp:2801265"
    ],
    "value": "Erythroxylaceae"
  },
  "goals": [],
  "id": "erythroxylum-argentinum",
  "image": {
    "attributionRequired": true,
    "author": "aacocucci",
    "license": "CC BY 4.0",
    "licenseUrl": "https://creativecommons.org/licenses/by/4.0",
    "pageUrl": "https://commons.wikimedia.org/wiki/File:Erythroxylum_argentinum_452542815.jpg",
    "refs": [
      "commons:File:Erythroxylum argentinum 452542815.jpg"
    ],
    "url": "https://upload.wikimedia.org/wikipedia/commons/3/33/Erythroxylum_argentinum_452542815.jpg"
  },
  "model": "claude-sonnet-5-5",
  "oil": null,
  "origin": {
    "refs": [
      "wcvp:2801265"
    ],
    "value": "Brasil, sur y oeste de Sudamérica"
  },
  "partsUsed": [],
  "promptVersion": 7,
  "recordVersion": 1,
  "refs": {
    "commons:File:Erythroxylum argentinum 452542815.jpg": {
      "dataset": "commons",
      "label": "Wikimedia Commons: File:Erythroxylum argentinum 452542815.jpg",
      "license": "CC BY 4.0",
      "url": "https://commons.wikimedia.org/wiki/File:Erythroxylum_argentinum_452542815.jpg"
    },
    "wcvp:2801265": {
      "dataset": "wcvp",
      "label": "WCVP: Erythroxylum argentinum O.E.Schulz",
      "license": "CC BY 3.0"
    },
    "wikipedia_es:Erythroxylum argentinum": {
      "dataset": "wikipedia_es",
      "label": "Wikipedia en español: Erythroxylum argentinum",
      "license": "CC BY-SA 4.0",
      "url": "https://es.wikipedia.org/wiki/Erythroxylum_argentinum"
    }
  },
  "reviewFlags": [
    {
      "code": "coincidencia-aproximada",
      "message": "El nombre resolvió por coincidencia aproximada (errata probable); requiere revisión.",
      "target": "scientificName"
    },
    {
      "code": "sin-nombre-comun-es",
      "message": "El paquete no trae ningún nombre común en español; el displayName es el nombre científico.",
      "target": "displayName"
    },
    {
      "code": "sin-datos-de-seguridad",
      "message": "El paquete no trae ninguna información de seguridad; la planta no se presenta como segura.",
      "target": "safety"
    }
  ],
  "safety": null,
  "scientificName": {
    "authors": "O.E.Schulz",
    "name": "Erythroxylum argentinum",
    "refs": [
      "wcvp:2801265"
    ]
  },
  "sources": [
    {
      "dataset": "commons",
      "license": "CC BY 4.0"
    },
    {
      "dataset": "wcvp",
      "license": "CC BY 3.0"
    },
    {
      "dataset": "wikipedia_es",
      "license": "CC BY-SA 4.0"
    }
  ],
  "synonyms": [],
  "traditionalUses": []
}
