{
  "aliases": [],
  "bundleHash": "sha256:3d122f5346a617a679d689de5b4c3e4fcba481ca0c3b90aabb93705c2191a005",
  "commonNames": [],
  "description": {
    "refs": [
      "wikipedia_es:Castanopsis concinna"
    ],
    "value": "Castanopsis concinna es una especie de planta fanerógama de la familia Fagaceae."
  },
  "displayName": {
    "language": "la",
    "refs": [
      "wcvp:35138"
    ],
    "value": "Castanopsis concinna"
  },
  "family": {
    "refs": [
      "wcvp:35138"
    ],
    "value": "Fagaceae"
  },
  "goals": [],
  "id": "castanopsis-concinna",
  "image": {
    "attributionRequired": true,
    "author": "阿橋 HQ",
    "license": "CC BY-SA 2.0",
    "licenseUrl": "https://creativecommons.org/licenses/by-sa/2.0",
    "pageUrl": "https://commons.wikimedia.org/wiki/File:%E8%8F%AF%E5%8D%97%E9%8C%90(%E6%AF%9B%E8%91%89%E6%A0%B2%E6%A0%97)_Castanopsis_concinna_-%E9%A6%99%E6%B8%AF%E8%A5%BF%E8%B2%A2%E7%8D%85%E5%AD%90%E6%9C%83%E8%87%AA%E7%84%B6%E6%95%99%E8%82%B2%E4%B8%AD%E5%BF%83_Saikung,_Hong_Kong-_(9240262558).jpg",
    "refs": [
      "commons:File:華南錐(毛葉栲栗) Castanopsis concinna -香港西貢獅子會自然教育中心 Saikung, Hong Kong- (9240262558).jpg"
    ],
    "url": "https://upload.wikimedia.org/wikipedia/commons/f/fd/%E8%8F%AF%E5%8D%97%E9%8C%90%28%E6%AF%9B%E8%91%89%E6%A0%B2%E6%A0%97%29_Castanopsis_concinna_-%E9%A6%99%E6%B8%AF%E8%A5%BF%E8%B2%A2%E7%8D%85%E5%AD%90%E6%9C%83%E8%87%AA%E7%84%B6%E6%95%99%E8%82%B2%E4%B8%AD%E5%BF%83_Saikung%2C_Hong_Kong-_%289240262558%29.jpg"
  },
  "model": "claude-sonnet-5-5",
  "oil": null,
  "origin": {
    "refs": [
      "wcvp:35138"
    ],
    "value": "China."
  },
  "partsUsed": [],
  "promptVersion": 7,
  "recordVersion": 1,
  "refs": {
    "commons:File:華南錐(毛葉栲栗) Castanopsis concinna -香港西貢獅子會自然教育中心 Saikung, Hong Kong- (9240262558).jpg": {
      "dataset": "commons",
      "label": "Wikimedia Commons: File:華南錐(毛葉栲栗) Castanopsis concinna -香港西貢獅子會自然教育中心 Saikung, Hong Kong- (9240262558).jpg",
      "license": "CC BY-SA 2.0",
      "url": "https://commons.wikimedia.org/wiki/File:%E8%8F%AF%E5%8D%97%E9%8C%90(%E6%AF%9B%E8%91%89%E6%A0%B2%E6%A0%97)_Castanopsis_concinna_-%E9%A6%99%E6%B8%AF%E8%A5%BF%E8%B2%A2%E7%8D%85%E5%AD%90%E6%9C%83%E8%87%AA%E7%84%B6%E6%95%99%E8%82%B2%E4%B8%AD%E5%BF%83_Saikung,_Hong_Kong-_(9240262558).jpg"
    },
    "wcvp:34945": {
      "dataset": "wcvp",
      "label": "WCVP: Castanea concinna Champ. ex Benth.",
      "license": "CC BY 3.0"
    },
    "wcvp:35138": {
      "dataset": "wcvp",
      "label": "WCVP: Castanopsis concinna (Champ. ex Benth.) A.DC.",
      "license": "CC BY 3.0"
    },
    "wikipedia_es:Castanopsis concinna": {
      "dataset": "wikipedia_es",
      "label": "Wikipedia en español: Castanopsis concinna",
      "license": "CC BY-SA 4.0",
      "url": "https://es.wikipedia.org/wiki/Castanopsis_concinna"
    }
  },
  "reviewFlags": [
    {
      "code": "sin-nombre-comun-es",
      "message": "El paquete no trae ningún nombre común en español; el nombre mostrado es el científico.",
      "target": "displayName"
    },
    {
      "code": "sin-datos-de-seguridad",
      "message": "El paquete no trae ninguna información de seguridad; la planta no se presenta como segura.",
      "target": "safety"
    }
  ],
  "safety": null,
  "scientificName": {
    "authors": "(Champ. ex Benth.) A.DC.",
    "name": "Castanopsis concinna",
    "refs": [
      "wcvp:35138"
    ]
  },
  "sources": [
    {
      "dataset": "commons",
      "license": "CC BY-SA 2.0"
    },
    {
      "dataset": "wcvp",
      "license": "CC BY 3.0"
    },
    {
      "dataset": "wikipedia_es",
      "license": "CC BY-SA 4.0"
    }
  ],
  "synonyms": [
    {
      "authors": "Champ. ex Benth.",
      "name": "Castanea concinna",
      "refs": [
        "wcvp:34945"
      ]
    }
  ],
  "traditionalUses": []
}
