{
  "aliases": [
    "hydnocarpus-venenata"
  ],
  "bundleHash": "sha256:3cad974a6a8c42e4ef7c0dae3b0bf873ab7fe6342f67575b05d464b7921b83ea",
  "commonNames": [],
  "description": {
    "refs": [
      "wikipedia_es:Hydnocarpus venenata"
    ],
    "value": "Es una especie de planta de la familia Achariaceae, endémica de Sri Lanka y amenazada por la pérdida de hábitat."
  },
  "displayName": {
    "language": "la",
    "refs": [
      "wcvp:2925491"
    ],
    "value": "Hydnocarpus venenatus"
  },
  "family": {
    "refs": [
      "wcvp:2925491"
    ],
    "value": "Achariaceae"
  },
  "goals": [],
  "id": "hydnocarpus-venenatus",
  "image": {
    "attributionRequired": true,
    "author": "Gihan Jayaweera",
    "license": "CC BY-SA 3.0",
    "licenseUrl": "https://creativecommons.org/licenses/by-sa/3.0",
    "pageUrl": "https://commons.wikimedia.org/wiki/File:Hydnocarpus_venenata_leaves.jpg",
    "refs": [
      "commons:File:Hydnocarpus venenata leaves.jpg"
    ],
    "url": "https://upload.wikimedia.org/wikipedia/commons/3/3c/Hydnocarpus_venenata_leaves.jpg"
  },
  "model": "claude-sonnet-5-5",
  "oil": null,
  "origin": {
    "refs": [
      "wcvp:2925491"
    ],
    "value": "Subcontinente indio (Sri Lanka)."
  },
  "partsUsed": [],
  "promptVersion": 7,
  "recordVersion": 1,
  "refs": {
    "commons:File:Hydnocarpus venenata leaves.jpg": {
      "dataset": "commons",
      "label": "Wikimedia Commons: File:Hydnocarpus venenata leaves.jpg",
      "license": "CC BY-SA 3.0",
      "url": "https://commons.wikimedia.org/wiki/File:Hydnocarpus_venenata_leaves.jpg"
    },
    "wcvp:2925491": {
      "dataset": "wcvp",
      "label": "WCVP: Hydnocarpus venenatus Gaertn.",
      "license": "CC BY 3.0"
    },
    "wikipedia_es:Hydnocarpus venenata": {
      "dataset": "wikipedia_es",
      "label": "Wikipedia en español: Hydnocarpus venenata",
      "license": "CC BY-SA 4.0",
      "url": "https://es.wikipedia.org/wiki/Hydnocarpus_venenata"
    }
  },
  "reviewFlags": [
    {
      "code": "variante-ortografica",
      "message": "El nombre resolvió por una variante ortográfica del epíteto.",
      "target": "scientificName"
    },
    {
      "code": "sin-nombre-comun-es",
      "message": "El paquete no trae ningún nombre común en español; el nombre para mostrar es el nombre científico.",
      "target": "displayName"
    },
    {
      "code": "sin-datos-de-seguridad",
      "message": "El paquete no trae información de seguridad; la planta no se presenta como segura.",
      "target": "safety"
    }
  ],
  "safety": null,
  "scientificName": {
    "authors": "Gaertn.",
    "name": "Hydnocarpus venenatus",
    "refs": [
      "wcvp:2925491"
    ]
  },
  "sources": [
    {
      "dataset": "commons",
      "license": "CC BY-SA 3.0"
    },
    {
      "dataset": "wcvp",
      "license": "CC BY 3.0"
    },
    {
      "dataset": "wikipedia_es",
      "license": "CC BY-SA 4.0"
    }
  ],
  "synonyms": [],
  "traditionalUses": []
}
